{
  "id": "models.list",
  "summary": "Discover unchanged provider-prefixed model IDs and gateway catalog metadata.",
  "requirements": ["AIG-R01", "AIG-R04"],
  "request": {
    "method": "GET",
    "path": "/v1/models",
    "auth": "bearer"
  },
  "response": {
    "status": 200,
    "json": {
      "object": "list",
      "data": [
        {
          "id": "anthropic/claude-haiku-4-5",
          "object": "model",
          "owned_by": "anthropic",
          "api": "anthropic-messages",
          "display_name": "Claude Haiku 4.5",
          "input_modalities": ["text", "image"],
          "context_length": 200000
        },
        {
          "id": "openrouter/~typesafe/jev-latest",
          "object": "model",
          "owned_by": "openrouter",
          "api": "systemone",
          "display_name": "jev",
          "input_modalities": ["text"],
          "kind": "judgment"
        }
      ]
    }
  },
  "expect": {
    "outcome": "success",
    "object": {
      "object": "list",
      "data": [
        {
          "id": "anthropic/claude-haiku-4-5",
          "object": "model",
          "owned_by": "anthropic",
          "api": "anthropic-messages",
          "display_name": "Claude Haiku 4.5",
          "input_modalities": ["text", "image"],
          "context_length": 200000
        },
        {
          "id": "openrouter/~typesafe/jev-latest",
          "object": "model",
          "owned_by": "openrouter",
          "api": "systemone",
          "display_name": "jev",
          "input_modalities": ["text"],
          "kind": "judgment"
        }
      ]
    }
  }
}
