{
  "id": "chat.stream.usage",
  "summary": "Retain incremental text and the choices-empty usage chunk before DONE.",
  "requirements": [
    "AIG-R03"
  ],
  "request": {
    "method": "POST",
    "path": "/v1/chat/completions",
    "auth": "none",
    "match": {
      "model": "anthropic/claude-haiku-4-5",
      "stream": true
    },
    "body": {
      "stream_options": {
        "include_usage": true
      }
    }
  },
  "response": {
    "status": 200,
    "sse": [
      {
        "id": "chatcmpl-test",
        "object": "chat.completion.chunk",
        "created": 1750000000,
        "model": "anthropic/claude-haiku-4-5",
        "choices": [
          {
            "index": 0,
            "delta": {
              "role": "assistant",
              "content": "Hel"
            },
            "finish_reason": null
          }
        ],
        "usage": null
      },
      {
        "id": "chatcmpl-test",
        "object": "chat.completion.chunk",
        "created": 1750000000,
        "model": "anthropic/claude-haiku-4-5",
        "choices": [
          {
            "index": 0,
            "delta": {
              "content": "lo!"
            },
            "finish_reason": null
          }
        ],
        "usage": null
      },
      {
        "id": "chatcmpl-test",
        "object": "chat.completion.chunk",
        "created": 1750000000,
        "model": "anthropic/claude-haiku-4-5",
        "choices": [
          {
            "index": 0,
            "delta": {},
            "finish_reason": "stop"
          }
        ],
        "usage": null
      },
      {
        "id": "chatcmpl-test",
        "object": "chat.completion.chunk",
        "created": 1750000000,
        "model": "anthropic/claude-haiku-4-5",
        "choices": [],
        "usage": {
          "prompt_tokens": 12,
          "completion_tokens": 3,
          "total_tokens": 15,
          "prompt_tokens_details": {
            "cached_tokens": 0
          }
        }
      },
      "[DONE]"
    ]
  },
  "expect": {
    "outcome": "success",
    "text": "Hello!",
    "usage": {
      "input": 12,
      "output": 3,
      "total": 15,
      "cached": 0
    }
  }
}
